<?xml version="1.0" encoding="utf-8" ?>
<root xmlns:xsi="http://www.w3.org/2001/XMLSchema-instance" xsi:noNamespaceSchemaLocation="WebControlProvider.xsd">
  <propertytype name="Boolean">
    <control typename="System.Web.UI.WebControls.CheckBox, System.Web, Version=2.0.0.0, Culture=neutral, PublicKeyToken=b03f5f7f11d50a3a" property="Checked" codefile=""/>
  </propertytype>
  <propertytype name="Int32">
    <editcontrol typename="ICSSoft.STORMNET.Web.AjaxControls.AlphaNumericTextBox, ICSSoft.STORMNET.Web.AjaxControls" property="Text" codefile="" />
  </propertytype>
  <propertytype name ="NullableInt">
    <editcontrol typename="ICSSoft.STORMNET.Web.AjaxControls.AlphaNumericTextBox, ICSSoft.STORMNET.Web.AjaxControls" property="Text" codefile="" />
  </propertytype>
  <propertytype name ="Int32?">
    <editcontrol typename="ICSSoft.STORMNET.Web.AjaxControls.AlphaNumericTextBox, ICSSoft.STORMNET.Web.AjaxControls" property="Text" codefile="" />
  </propertytype>
  <propertytype name="NullableDateTime">
    <control typename="ICSSoft.STORMNET.Web.AjaxControls.FormattedDateTimeControl" property="Text" codefile=""/>
    <editcontrol typename="ICSSoft.STORMNET.Web.AjaxControls.DatePicker" property="Text" codefile=""/>
  </propertytype>
  <propertytype name="DateTime">
    <control typename="ICSSoft.STORMNET.Web.AjaxControls.FormattedDateTimeControl" property="Text" codefile=""/>
    <editcontrol typename="ICSSoft.STORMNET.Web.AjaxControls.DatePicker" property="Text" codefile=""/>
  </propertytype>
  <propertytype name="DateTime?">
    <control typename="ICSSoft.STORMNET.Web.AjaxControls.FormattedDateTimeControl" property="Text" codefile=""/>
    <editcontrol typename="ICSSoft.STORMNET.Web.AjaxControls.DatePicker" property="Text" codefile=""/>
  </propertytype>
  <propertytype name="Contact">
    <control typename="ICSSoft.STORMNET.Web.AjaxControls.ContactControl, ICSSoft.STORMNET.Web.AjaxControls, Version=1.0.4805.31119, Culture=neutral, PublicKeyToken=null" property="Text" codefile=""/>
  </propertytype>
  <propertytype name="Event">
    <control typename="ICSSoft.STORMNET.Web.AjaxControls.EventControl, ICSSoft.STORMNET.Web.AjaxControls, Version=1.0.4805.31119, Culture=neutral, PublicKeyToken=null" property="Text" codefile=""/>
  </propertytype>
</root>
